[
  {
    "id": "project:xenosync",
    "type": "Project",
    "title": "xenosync",
    "url": "/projects/xenosync",
    "tags": [
      "ai",
      "fullstack",
      "TypeScript",
      "Node.js",
      "LLM APIs",
      "Automation"
    ],
    "body": "Multi-agent AI orchestration platform coordinating parallel Claude Code sessions. Coordinates parallel coding agents, reconciles outputs, and improves throughput for multi-threaded implementation work. Coordinates parallel coding sessions across specialized agents. Includes orchestration controls for retries and merge workflows. Built to improve throughput while preserving output quality. \n## Context\nParallel coding and analysis sessions create coordination overhead and merge conflicts.\n\n## Approach\nDesigned a controller pattern to assign tasks to specialized agents and collect outputs into a structured merge queue.\n\n## Architecture\nCoordinator service -> session workers -> merge/reconciliation layer -> final artifact pipeline.\n\n## Results\nImproved throughput for multi-thread implementation work while reducing failed joins.\n\n## Lessons\nAgent orchestration quality depends more on control-plane design than prompt quality alone.\n\n## Artifacts\n- Repo: https://github.com/kspringfield13/xenosync\n\n## If I had 2 more weeks...\nAdd conflict scoring and detailed run telemetry dashboards."
  },
  {
    "id": "project:chatdeb",
    "type": "Project",
    "title": "chatdeb",
    "url": "/projects/chatdeb",
    "tags": [
      "ai",
      "data",
      "fullstack",
      "FastAPI",
      "OpenAI",
      "LangChain",
      "DuckDB"
    ],
    "body": "Full-stack chatbot for analyzing business data. Combines FastAPI, OpenAI/LangChain, DuckDB/dbt, and React/Next for data-aware conversational analysis. Conversational layer grounded in business data models. Full-stack architecture with API and modern frontend. Supports practical exploration of KPI and trend questions. \n## Context\nBusiness users need conversational analytics that still respects modeled data contracts.\n\n## Approach\nBuilt a full-stack assistant with FastAPI + OpenAI/LangChain on top of DuckDB/dbt models and a React/Next interface.\n\n## Architecture\nUI query layer -> API orchestration -> retrieval + LLM response synthesis -> dbt-modeled warehouse tables.\n\n## Results\nEnabled faster exploratory analysis while maintaining traceability to governed data models.\n\n## Lessons\nConversation UX improves only when response grounding and metric definitions are explicit.\n\n## Artifacts\n- Repo: https://github.com/kspringfield13/chatdeb\n\n## If I had 2 more weeks...\nShip richer source citations and query execution observability."
  },
  {
    "id": "project:ecommerce-dbt",
    "type": "Project",
    "title": "ecommerce-dbt",
    "url": "/projects/ecommerce-dbt",
    "tags": [
      "data",
      "dbt",
      "DuckDB",
      "SQL",
      "CI/CD"
    ],
    "body": "End-to-end dbt pipeline on DuckDB with tests, docs, and CI. Demonstrates dbt best practices: schema tests, data documentation, and CI enforcement in a realistic e-commerce domain. End-to-end warehouse modeling with dbt. Schema tests and docs integrated into CI. Patterns designed for maintainable analytics engineering. \n## Context\nAnalytics teams need reproducible dbt patterns that cover modeling, testing, docs, and CI from day one.\n\n## Approach\nCreated an end-to-end e-commerce pipeline on DuckDB with layered models, schema tests, and docs generation in CI.\n\n## Architecture\nRaw staging -> intermediate transforms -> marts -> schema tests/docs -> CI validation.\n\n## Results\nProduced a reusable analytics engineering starter that emphasizes reliability and maintainability.\n\n## Lessons\nAutomated testing and docs are not polish; they are core delivery infrastructure.\n\n## Artifacts\n- Repo: https://github.com/kspringfield13/ecommerce-dbt\n\n## If I had 2 more weeks...\nAdd semantic layer examples and freshness SLA checks."
  },
  {
    "id": "project:elt-pipeline",
    "type": "Project",
    "title": "elt-pipeline",
    "url": "/projects/elt-pipeline",
    "tags": [
      "data",
      "dbt",
      "Snowflake",
      "SQL",
      "Python"
    ],
    "body": "dbt + Snowflake ELT pipeline patterns. Reference implementation for ELT workflows on Snowflake with modular transformations and production-friendly conventions. Production-minded ELT structure for Snowflake. Reusable transformation layers and model patterns. Focuses on reliability and maintainability. \n## Context\nTeams adopting Snowflake often need reference ELT patterns beyond isolated SQL scripts.\n\n## Approach\nDeveloped modular dbt + Snowflake pipeline conventions for reliable ingestion and transformation.\n\n## Architecture\nSource ingestion -> Snowflake staging -> dbt model layers -> curated marts and outputs.\n\n## Results\nDelivered a maintainable blueprint for analytics engineering workflows in Snowflake.\n\n## Lessons\nModel layering and naming discipline prevent long-term complexity blowups.\n\n## Artifacts\n- Repo: https://github.com/kspringfield13/elt-pipeline\n\n## If I had 2 more weeks...\nPackage reusable macros for cross-domain standardization."
  },
  {
    "id": "project:weekform",
    "type": "Project",
    "title": "weekform",
    "url": "/projects/weekform",
    "tags": [
      "ai",
      "data",
      "fullstack",
      "TypeScript",
      "React",
      "Tauri",
      "Rust"
    ],
    "body": "Local-first macOS workload intelligence and explainable capacity planning for analysts. Turns calendar events and foreground-app activity into reviewable work blocks, explainable weekly allocation, and reliable capacity estimates for new work. Groups local foreground-app signals and Outlook calendar events into reviewable work sessions with confidence and evidence. Calculates reliable new-work capacity from recurring commitments, reactive load, carryover risk, fragmentation, and work in progress. Adds optional OpenAI-assisted classification, review suggestions, forecasts, and narratives while keeping raw activity data under user control. \n## Context\nAnalyst workload is split across planned projects, recurring reporting, meetings, reactive requests, debugging, and coordination. Task lists capture only part of that work, making it difficult to explain current allocation or estimate how much new work a team can reliably absorb.\n\n## Approach\nBuilt a local-first macOS prototype that combines foreground-app activity with Outlook calendar events. Weekform groups those signals into candidate work sessions, then gives the user a Daily Review workflow to confirm, relabel, merge, exclude, or annotate the inferred work before it contributes to planning.\n\n## Architecture\n- React, TypeScript, and Vite power the review ledger, capacity views, audit history, and editable analyst and manager summaries.\n- Tauri and Rust provide the macOS menu-bar shell, foreground-window sampling, pause controls, native permissions, and optional OpenAI commands.\n- Shared domain packages model activity, work blocks, corrections, audit events, privacy levels, and weekly capacity snapshots.\n- Deterministic inference groups local activity samples and calculates capacity from recurring commitments, carryover risk, reactive load, fragmentation, and work i"
  },
  {
    "id": "project:xbot",
    "type": "Project",
    "title": "xbot",
    "url": "/projects/xbot",
    "tags": [
      "ai",
      "fullstack",
      "Python",
      "OpenAI API",
      "Automation",
      "APIs"
    ],
    "body": "OpenAI-powered automation bot for generating posts and images to X/Discord. Automates social content workflows using LLM prompting and media generation with cross-platform posting. Generates and publishes content automatically. Combines text and image generation flows. Targets practical automation across multiple channels. \n## Context\nManual content generation and distribution can bottleneck experiments and audience iteration.\n\n## Approach\nImplemented an OpenAI-powered automation workflow generating text/images and posting to X and Discord.\n\n## Architecture\nPrompt templates -> generation services -> media pipeline -> channel posting adapters.\n\n## Results\nReduced manual publishing overhead and increased iteration speed for content experiments.\n\n## Lessons\nAutomation quality improves when editorial constraints are encoded up front.\n\n## Artifacts\n- Repo: https://github.com/kspringfield13/xbot\n\n## If I had 2 more weeks...\nAdd policy guardrails and per-channel adaptive tone tuning."
  },
  {
    "id": "project:xagg",
    "type": "Project",
    "title": "xagg",
    "url": "/projects/xagg",
    "tags": [
      "data",
      "fullstack",
      "Python",
      "Streamlit",
      "APIs",
      "Data aggregation"
    ],
    "body": "Streamlit news aggregator combining headlines and market data. Aggregates and presents market context by combining news signals with financial data feeds. Combines headlines with market data for quick situational awareness. Interactive dashboard for exploration and filtering. Shows practical integration of multiple external sources. \n## Context\nAnalysts tracking market context need faster signal aggregation across news and financial inputs.\n\n## Approach\nBuilt a Streamlit app combining headline streams and market data feeds into one exploration interface.\n\n## Architecture\nData connectors -> normalization layer -> scoring/filter logic -> Streamlit presentation.\n\n## Results\nCreated a rapid context dashboard for monitoring topical and market movement.\n\n## Lessons\nSignal usefulness depends on ranking and filtering, not just source volume.\n\n## Artifacts\n- Repo: https://github.com/kspringfield13/xagg\n\n## If I had 2 more weeks...\nAdd alerting thresholds and persistent watchlists."
  },
  {
    "id": "project:intercoach",
    "type": "Project",
    "title": "intercoach",
    "url": "/projects/intercoach",
    "tags": [
      "ai",